{"schemaVersion":"1.0.0","surveyId":"survey-example","generatedAtEpochMs":1790000000000,"appVersion":"0.4.0-m4","coordinateMode":"full","includesIq":true,"includesRoutes":true,"includesNotes":true,"includesDeviceIdentifiers":true,"deviceSerialSuffix":"1234abcd","notes":"reviewed","files":[{"path":"observations.csv","bytes":10,"sha256":"cccccccccccccccccccccccccccccccccccccccccccccccccccccccccccccccc"}]}
